{
  "action": "study.promote-behavior",
  "actor": "kc",
  "created_at": "2026-08-16T21:53:31Z",
  "id": "activity-9eeade799793d3c26f32",
  "idempotency_key": "discord:1538666235619704842:study.promote-behavior",
  "origin": "discord",
  "result": {
    "component_kind": "behavior",
    "content_hash": "sha256:da847421736d8179c34d51afbcc7ab9f96a925ed461f4d0b2fb190db4b49983c",
    "id": "component-behavior-2e6832d7d826",
    "rationale": "KC approved shallow-3D Parallel cohorts as Study 003's canonical Behavior after the straight-on 960-step endurance review; Mixed remains an exploratory sibling and Neighbor remains held evidence.",
    "schema_version": 1,
    "source_artifact_ref": "work/studio/handoffs/study-003-affinity-shallow3d-parallel-v1/behavior-review-straight-on.mp4",
    "source_experiment_id": "experiment-study-003-affinity-parallel-endurance-v1",
    "state": "promoted",
    "track": "behavior",
    "visibility": "private"
  },
  "result_refs": [
    "component-behavior-2e6832d7d826"
  ],
  "schema_version": 1,
  "source_ref": "discord-message:1538666235619704842",
  "state": "completed",
  "study_id": "study-003-nonlocal-affinity-dance",
  "summary": "Promote shallow-3D Parallel cohorts as Study 003 canonical Behavior.",
  "updated_at": "2026-08-16T21:53:31Z",
  "visibility": "private"
}
